iteration,timestamp,response,word_count,unique_word_count,coherence_score,is_repetitive,lexical_similarity,semantic_similarity,is_semantically_repetitive,semantic_surprise,max_semantic_surprise,is_surprising
0,2025-02-26 16:15:28.059392,What are your thoughts on sauterne?,6,6,1.0,,,,,,,
1,2025-02-26 16:15:35.899694,"Sauternes is a renowned sweet wine from the Sauternais region of Bordeaux, France. It’s celebrated for its rich flavors and complexity, primarily made using grapes such as Sémillon, Sauvignon Blanc, and Muscadelle. These wines are distinguished by their production process involving ""noble rot"" or Botrytis cinerea—a beneficial fungus that dehydrates the grapes while concentrating sugars and flavors.

The result is a luscious dessert wine with notes often described as apricot, honeyed citrus fruits, peach marmalade alongside hints of nuts like almond or hazelnut due to aging in oak barrels. A well-made sauterne balances sweetness with acidity which allows it to pair wonderfully not only with desserts but also savory dishes like foie gras or blue cheeses.

Overall it's cherished worldwide among connoisseurs both for drinking young when fruit-forwardness shines through vividly yet possessing incredible potential continuing developing more nuanced character over decades if properly cellared!",145,127,0.8758620689655172,False,0.007575757575757576,0.5248709321022034,False,0.0012371856719255447,0.0012371856719255447,False
2,2025-02-26 16:15:48.166944,"Sauternes is indeed a remarkable wine, celebrated for its unique production process and exquisite flavor profile. The use of ""noble rot"" or Botrytis cinerea plays a crucial role in creating the distinctive sweetness and complexity that Sauternes is known for. By dehydrating the grapes, this beneficial fungus concentrates their natural sugars while also enhancing flavors.

The primary grape varieties used—Sémillon, Sauvignon Blanc, and Muscadelle—each contribute to the wine's character: Sémillon brings richness and body; Sauvignon Blanc adds acidity and freshness; while Muscadelle offers floral notes. Together with oak barrel aging, these elements result in wines bursting with aromas like apricot jam, honeyed citrus fruits such as orange peel or lemon zest alongside subtle nutty undertones from almonds or hazelnuts.

One of Sauternes' most appealing attributes is its versatility when it comes to food pairings. While it's traditionally enjoyed as a dessert wine complementing sweet dishes like fruit tarts or crème brûlée due to its lusciousness balanced by vibrant acidity—it can be equally impressive paired with savory items too! Classic combinations include foie gras where both textures harmonize beautifully together plus salty blue cheeses providing contrast against intense fruity layers unfolding sip after satisfying sip!

As you mentioned about cellaring potential—a well-crafted bottle has an exceptional ability not only retaining youthful vivacity over several years but evolving into complex mature expressions appreciated greatly among aficionados around globe who treasure discovering new depths emerging gracefully given proper storage conditions allowing patience rewarded tenfold eventually transforming every tasting experience uniquely memorable event cherished lifetime long journey savoring finest vinous artistry Bordeaux region proudly produces generation upon generations skillful winemakers dedicated crafting legendary golden elixir truly one-of-a-kind delight savored beyond compare worldwide esteemed reputation secured firmly history viticulture excellence unmatched anywhere else earth today tomorrow always forevermore…",293,261,0.8907849829351536,False,0.19384615384615383,0.9065905809402466,True,0.0009076299611479044,0.0015722436364740133,False
3,2025-02-26 16:15:57.574204,"Sauternes is indeed a remarkable wine, celebrated for its unique production process and exquisite flavor profile. The use of ""noble rot,"" or Botrytis cinerea, plays a crucial role in creating the distinctive sweetness and complexity that Sauternes is known for. By dehydrating the grapes, this beneficial fungus concentrates their natural sugars while also enhancing flavors.

The primary grape varieties used—Sémillon, Sauvignon Blanc, and Muscadelle—each contribute to the wine's character: Sémillon brings richness and body; Sauvignon Blanc adds acidity and freshness; while Muscadelle offers floral notes. Together with oak barrel aging, these elements result in wines bursting with aromas like apricot jam and honeyed citrus fruits such as orange peel or lemon zest alongside subtle nutty undertones from almonds or hazelnuts.

One of Sauternes' most appealing attributes is its versatility when it comes to food pairings. While it's traditionally enjoyed as a dessert wine complementing sweet dishes like fruit tarts or crème brûlée due to its lusciousness balanced by vibrant acidity—it can be equally impressive paired with savory items too! Classic combinations include foie gras where both textures harmonize beautifully together plus salty blue cheeses providing contrast against intense fruity layers unfolding sip after satisfying sip!

As you mentioned about cellaring potential—a well-crafted bottle has an exceptional ability not only retaining youthful vivacity over several years but evolving into complex mature expressions appreciated greatly among aficionados around globe who treasure discovering new depths emerging gracefully given proper storage conditions allowing patience rewarded tenfold eventually transforming every tasting experience uniquely memorable event cherished lifetime long journey savoring finest vinous artistry Bordeaux region proudly produces generation upon generations skillful winemakers dedicated crafting legendary golden elixir truly one-of-a-kind delight savored beyond compare worldwide esteemed reputation secured firmly history viticulture excellence unmatched anywhere else on earth today tomorrow always forevermore…",295,262,0.888135593220339,True,0.9735849056603774,0.99428391456604,True,0.0005901206750422716,0.001521809957921505,False
