iteration,timestamp,response,word_count,unique_word_count,coherence_score,is_repetitive,lexical_similarity,semantic_similarity,is_semantically_repetitive,semantic_surprise,max_semantic_surprise,is_surprising
0,2025-02-26 16:22:52.323927,Explain how misframes influences dividend.,5,5,1.0,,,,,,,
1,2025-02-26 16:22:54.521364,"The term ""misframes"" isn't a standard financial or economic concept, so it might be helpful to clarify what you mean by this. However, if we interpret ""misframes"" as potentially referring to miscommunications or misunderstandings within corporate governance and management decisions regarding dividends, then the influence on dividend policy could include:

1. **Miscommunication of Financial Health**: If there's a misunderstanding about the company's profitability or cash flow due to incorrect framing of financial data (a possible interpretation for ""misframe""),",78,66,0.8461538461538461,False,0.0,0.7788518071174622,False,0.0005764737725257874,0.0005764737725257874,False
2,2025-02-26 16:22:58.214636,"it could lead to inappropriate dividend decisions. For instance, if a company's financial health is overstated due to misframes in reporting or communication, the board might decide on higher dividends than what can be sustainably supported by actual cash flows. This can strain liquidity and potentially harm long-term growth prospects.

2. **Investor Relations Issues**: Misframing information about company strategy or future earnings expectations may affect how investors perceive the firm's ability to pay consistent dividends. If management unintentionally overpromises through poorly communicated",82,76,0.926829268292683,False,0.18333333333333332,0.7528978586196899,False,0.0007744227768853307,0.0009043504251167178,False
3,2025-02-26 16:22:59.601651,"or misframed information, it could lead to a mismatch between investor expectations and actual performance. This can result in disappointment among investors if the anticipated dividends are not realized, potentially causing stock price volatility or loss of trust.

3. **Regulatory Risks**: Inaccurate reporting due to misframes might attract regulatory scrutiny. Regulators may impose fines or sanctions on companies that consistently provide misleading financial communications, which can damage reputation and incur additional costs for compliance adjustments.

4. **Internal Management Challenges**",79,74,0.9367088607594937,False,0.20967741935483872,0.8484781980514526,False,0.0006996866432018578,0.0009928490035235882,False
4,2025-02-26 16:23:00.935225,": Misframed information can lead to internal management challenges by creating confusion and misalignment within the organization. If different departments have varying interpretations of financial data, it could hinder decision-making processes, strategic planning, and resource allocation. This disconnect might also affect morale if employees feel they are not operating with a clear understanding of company performance or objectives.

5. **Operational Risks**: The reliance on inaccurate or misleading information may result in poor operational decisions that impact efficiency and productivity. For example, investing in projects",84,76,0.9047619047619048,False,0.21951219512195122,0.7639454007148743,False,0.0008366702240891755,0.000989673426374793,False
5,2025-02-26 16:23:02.801336,"based on incorrect data could lead to resource wastage or missed opportunities. If a company commits resources to initiatives that are not aligned with the actual business needs or market conditions, it might face delays and increased costs. Furthermore, operational risks can extend to supply chain management where misinterpreted demand forecasts result in overstocking or stockouts, disrupting production schedules and customer satisfaction.

6. **Reputational Damage**: Miscommunication of financial health due to misframed information can damage an organization's reputation among",79,72,0.9113924050632911,False,0.21311475409836064,0.7885384559631348,False,0.000728869519662112,0.0009428818593733013,False
6,2025-02-26 16:23:04.740508,"stakeholders, including investors, customers, and partners. If stakeholders lose trust in the company's ability to accurately report or manage its financial situation, it can lead to a loss of business opportunities and affect stock prices negatively. This reputational damage might also result in increased scrutiny from regulators or could deter potential clients who prioritize transparency.

7. **Compliance Issues**: Inaccurate data reporting may lead organizations into non-compliance with industry regulations or legal requirements. Failing to meet these obligations not only results in",81,73,0.9012345679012346,False,0.1693548387096774,0.7285019159317017,False,0.0007747802883386612,0.0009172289865091443,False
7,2025-02-26 16:23:06.242336,"fines and penalties but can also lead to more severe consequences such as legal action or revocation of licenses. Compliance issues undermine the company's credibility and could result in long-term financial damage, affecting its ability to operate effectively.

8. **Operational Inefficiencies**: Inaccurate data can cause disruptions in operations by leading to poor decision-making based on faulty information. This may manifest as inventory mismanagement, production delays, or inefficient allocation of resources—each impacting customer satisfaction and overall business performance.

9",78,69,0.8846153846153846,False,0.17355371900826447,0.7135933637619019,False,0.0007333116955123842,0.0008147400221787393,False
8,2025-02-26 16:23:09.679391,". **Reputational Damage**: Inaccurate data can severely impact a company's reputation, as stakeholders may lose trust in the organization's ability to provide reliable services or products. Negative publicity resulting from errors can deter potential customers and partners, ultimately affecting sales and growth prospects.

10. **Missed Opportunities for Innovation**: Reliable data is crucial for identifying trends and opportunities that drive innovation within a company. When inaccuracies exist, it becomes challenging to spot these insights accurately, potentially leading to missed chances for product",81,70,0.8641975308641975,False,0.112,0.6371258497238159,False,0.0008028373122215271,0.0009427845943719149,False
9,2025-02-26 16:23:12.352787,"development, market expansion, and competitive advantage. Organizations may overlook emerging consumer needs or fail to capitalize on new technologies due to the lack of trustworthy data.

11. **Operational Inefficiencies**: Inaccurate data can lead to inefficient processes across various departments within a company. Decision-making based on faulty information might result in resource misallocation, increased operational costs, and wasted efforts as teams pursue ineffective strategies or solutions that do not address actual problems.

12. **Regulatory Compliance Risks**: Many industries",77,72,0.935064935064935,False,0.109375,0.6783061027526855,False,0.0007083459640853107,0.0008359940256923437,False
10,2025-02-26 16:23:19.719411,"are subject to strict regulatory requirements that mandate accurate data reporting and record-keeping. Inaccurate or incomplete data can lead to non-compliance with these regulations, resulting in legal penalties, fines, and damage to the organization's reputation. Ensuring compliance requires rigorous validation of data accuracy and integrity.

13. **Customer Trust Erosion**: Consumers expect companies to handle their information responsibly and accurately. Errors in customer-related data—such as incorrect billing details or mishandling personal information—can erode trust",73,62,0.8493150684931506,False,0.11666666666666667,0.6655921936035156,False,0.0008153806556947529,0.0008741065394133329,False
